{
  "clients": {
    "ipify": {
      "address": "https://api.ipify.org",
      "timeout": 1
    }
  },
  "enabled": true,
  "log": {
    "address": "",
    "format": "JSON",
    "level": "INFO",
    "network": ""
  },
  "remoteConfigEndpoint": "",
  "remoteConfigPath": "",
  "remoteConfigProvider": "",
  "remoteConfigSecretKeyring": "",
  "servers": {
    "monitoring": {
      "address": ":8072",
      "timeout": 60
    },
    "public": {
      "address": ":8071",
      "timeout": 60
    }
  },
  "shutdown_timeout": 1,
  "random": {
    "charset": "!#$%&()*+,-./0123456789:;<=>?@ABCDEFGHIJKLMNOPQRSTUVWXYZ^_abcdefghijklmnopqrstuvwxyz~",
    "length": 32,
    "quantity": 10
  }
}
